<?xml version="1.0" encoding="UTF-8" standalone="yes"?>
<gbcs:server xmlns:xs="http://www.w3.org/2001/XMLSchema-instance"
             xmlns:gbcs="urn:net.woggioni.gbcs.server"
             xmlns:gbcs-memcached="urn:net.woggioni.gbcs.server.memcached"
             xs:schemaLocation="urn:net.woggioni.gbcs.server.memcached jpms://net.woggioni.gbcs.server.memcached/net/woggioni/gbcs/server/memcached/schema/gbcs-memcached.xsd urn:net.woggioni.gbcs.server jpms://net.woggioni.gbcs.server/net/woggioni/gbcs/server/schema/gbcs.xsd">
    <bind host="127.0.0.1" port="11443" incoming-connections-backlog-size="50"/>
    <connection
            write-timeout="PT25M"
            read-timeout="PT20M"
            read-idle-timeout="PT10M"
            write-idle-timeout="PT11M"
            idle-timeout="PT30M"
            max-request-size="101325"/>
    <event-executor use-virtual-threads="false"/>
    <cache xs:type="gbcs-memcached:memcachedCacheType" max-age="P7D" max-size="101325" digest="SHA-256">
        <server host="127.0.0.1" port="11211"/>
    </cache>
    <authentication>
        <none/>
    </authentication>
</gbcs:server>