<?xml version="1.0" encoding="UTF-8" standalone="yes"?>
<gbcs:server xmlns:xs="http://www.w3.org/2001/XMLSchema-instance"
             xmlns:gbcs="urn:net.woggioni.gbcs.server"
             xs:schemaLocation="urn:net.woggioni.gbcs.server jpms://net.woggioni.gbcs.server/net/woggioni/gbcs/server/schema/gbcs.xsd">
    <bind host="127.0.0.1" port="11443" incoming-connections-backlog-size="180"/>
    <connection
            write-timeout="PT25M"
            read-timeout="PT20M"
            read-idle-timeout="PT10M"
            write-idle-timeout="PT11M"
            idle-timeout="PT30M"
            max-request-size="4096"/>
    <event-executor use-virtual-threads="false"/>
    <cache xs:type="gbcs:fileSystemCacheType" path="/tmp/gbcs" max-age="P7D"/>
    <authorization>
        <users>
            <user name="user1" password="password1"/>
            <user name="user2" password="password2"/>
            <user name="user3" password="password3"/>
        </users>
        <groups>
            <group name="readers">
                <users>
                    <user ref="user1"/>
<!--                    <user ref="user5"/>-->
                    <anonymous/>
                </users>
                <roles>
                    <reader/>
                </roles>
            </group>
            <group name="writers">
                <users>
                    <user ref="user2"/>
                </users>
                <roles>
                    <writer/>
                </roles>
            </group>
            <group name="readers-writers">
                <users>
                    <user ref="user3"/>
                </users>
                <roles>
                    <reader/>
                    <writer/>
                </roles>
            </group>
        </groups>
    </authorization>
    <authentication>
        <client-certificate>
            <group-extractor pattern="group-pattern" attribute-name="O"/>
            <user-extractor pattern="user-pattern" attribute-name="CN"/>
        </client-certificate>
    </authentication>
    <tls>
        <keystore file="keystore.pfx" key-alias="key1" password="password" key-password="key-password"/>
        <truststore file="truststore.pfx" password="password" check-certificate-status="true" />
    </tls>
</gbcs:server>